{
  "schemaVersion": "1",
  "status": "FAIL",
  "evidenceMode": "PARTIAL_OFFLINE",
  "policyVersion": 4,
  "golden": {
    "passed": 6,
    "total": 6,
    "executionMode": "OPA_CLI"
  },
  "generated": {
    "passed": 35,
    "total": 35,
    "executionMode": "OPA_CLI"
  },
  "driftBefore": 16,
  "driftAfter": null,
  "evaluationOnlyFixedFixtureDrift": 0,
  "mutation": {
    "killed": 44,
    "total": 47,
    "excludedEquivalent": 0,
    "killRate": 0.9361702127659575,
    "executionMode": "REFERENCE_EVALUATOR_NOT_OPA"
  },
  "regression": {
    "passed": null,
    "total": null,
    "status": "NOT_RUN"
  },
  "traceability": {
    "clausesCovered": 4,
    "clausesTotal": 4,
    "rulesCovered": 4,
    "rulesTotal": 4,
    "unlinkedCodeLocations": 0
  },
  "security": {
    "critical": null,
    "high": null,
    "status": "NOT_RUN"
  },
  "externalGates": {
    "gpt56": "NOT_RUN",
    "opa": "PASS",
    "codex": "NOT_RUN",
    "browser": "NOT_RUN",
    "container": "NOT_RUN",
    "deployment": "NOT_RUN"
  },
  "evidenceHash": "c8378b3d70930548dff301dd9cf936aa21f7b64100181ccf1c43a5b2cd54f418",
  "createdAt": "2026-07-14T01:00:00.000Z"
}
